movieId,keywords
862,"jealousy, toy, boy, friendship, friends, rivalry, boy next door, new toy, toy comes to life"
8844,"board game, disappearance, based on children's book, new home, recluse, giant insect"
949,"robbery, detective, bank, obsession, chase, shooting, thief, honor, murder, suspense, heist, betrayal, money, gang, cat and mouse, criminal mastermind, cult film, ex-con, heist movie, one last job, loner, bank job, neo-noir, gun fight, crime epic"
710,"cuba, falsely accused, secret identity, computer virus, secret base, secret intelligence service, kgb, satellite, special car, cossack, electromagnetic pulse, time bomb, st. petersburg russia, ejection seat, red army"
1408,"exotic island, treasure, map, ship, scalp, pirate"
524,"poker, drug abuse, 1970s, overdose, illegal prostitution"
4584,"bowling, based on novel, servant, country life, jane austen, inheritance, military officer, period drama, rainstorm, horse and carriage, decorum"
5,"hotel, new year's eve, witch, bet, hotel room, sperm, los angeles, hoodlum, woman director, episode film"
8012,"gambling, miami, based on novel, job, murder, travel, mafia, money, debt, mobster, business, hollywood, gangster, crime, violence, drug, producer, con"
1710,"police brutality, psychology, police operation, police protection, serial killer, psychologist, cowardliness"
451,"individual, prostitute, alcohol, casino, love at first sight, lovesickness, film producer, screenwriter, hotel room, dying and death, rage and hate, unsociability, alcoholism, los angeles, alcohol abuse, attempted suicide"
902,"clone, dream, island, eye, dystopia, aging, friendship, rescue, children, girl, childhood"
63,"schizophrenia, philadelphia, cassandra syndrom, stockholm syndrome, time travel, post-apocalyptic, dystopia, lethal virus, monkey, subterranean"
687,"prison, rape, socially deprived family, penalty, death penalty, despair, death row, begnadigung, therapist, self-discovery, prison cell, court case, death sentence, doomed man, sentence, lethal injection, forgiveness, charity, mercy petition, rage and hate, unsociability, right and justice, court, electric chair, cowardliness"
139405,
577,"adultery, winter, obsession, television, new hampshire, narcissistic personality disorder"
807,"self-fulfilling prophecy, detective, s.w.a.t., drug dealer, evisceration, lust and impulsiveness, rage and hate, pride and vanity, immoderateness, insomnia, investigation, pension, police, serial killer"
8391,"professor, lgbt, woman director"
629,"law, relatives, theft, criminal, criminal mastermind, hungarian, sibling"
2054,"composer, mentor, deaf-mute, musical, apprentice, private life, music, disabled"
4482,"love triangle, southern france, estate agent, menage a trois, van, woman director"
755,"dancing, brother brother relationship, sexual obsession, showdown, sheriff, eroticism, nudity, bank robber, vampire, holy water, siege, stripper, priest, explosion, extreme violence, bank robbery, preacher, hostage situation, crucifix, recreational vehicle, blood spurting, convenience store, female vampire, mexican american border, nightclub entertainer, boa constrictor"
27526,"loss of daughter, hit-and-run driving , revenge, suspense, independent film, tragedy"
400,"father son relationship, bounty hunter, boat, way of life, coffin, denver, godmother, paranoia, hitman, friendship, psychopath, revenge, murder, independent film, mafia, diner, blood, gangster, violence, illegal prostitution, extramarital affair"
880,"suicide, underdog, free love, philosophy, rape, mentally disabled, loss of mother, village life, world war ii, feminism, indian summer , family history, widow, peasant, village, mathematics, freedom, right and justice, single, homosexuality, mother daughter relationship, domestic violence, university, woman director"
8447,"class society, rich woman - poor man, scientist, naturalist, insect"
2086,"assassination, train station, politics, los angeles"
406,"paris, neo-nazi, skinhead, robbery, police brutality, hip-hop, gun, socially deprived family, breakdance, arabian, boredom, revenge, suburb, violence, police officer, unemployment, capture, xenophobia"
2045,"wife husband relationship, experiment, police, murder, suspense, memory, forensic, gunman, animal experimentation"
688,"farewell, adultery, love at first sight, photographer, wife husband relationship, iowa, love of one's life, mother role, bridge, housewife, love letter, peasant, marriage crisis, photography, unsociability, secret love, nature documentary"
197,"individual, scotland, in love with enemy, legend, independence, idealism, revolt, tyranny"
103,"vietnam veteran, taxi, obsession, drug dealer, night shift, vigilante, alienation, misanthrope, shot to death, illegal prostitution, loner"
2074,"lsd, looking for  birth parents, half-brother, independent film"
27793,"flying, magic"
5757,"homosexuality, independent film, mockumentary"
124639,
568,"moon, florida, nasa, spaceman, race against time, houston, based on true story, space, rescue, survival, disaster, explosion, astronaut, imax, saturn v rocket, courage, hypothermia, apollo program, cape kennedy, lunar mission, spacecraft accident"
414,"riddle, dc comics, rose, gotham city, partner, superhero, robin, broken neck, psychologist, violence, criminal, district attorney, millionaire, falling down stairs, tied up, tommy gun, beretta, knocked out, super powers, disfigurement, father figure"
649,"prostitute, adultery, double life, dual identity, jealousy, wife husband relationship, brothel, dream, women's sexual identity, fantasy, masochism, independent film"
1873,"burma, rangoon, doctor"
5894,"smoking, corner shop, cigarette, tobacco, cigar, independent film"
8839,"halloween, friendship, supernatural, afterlife, friends, danger, ghost, disorder, young heroes, imaginary, supernatural ability, mischievous children"
8963,"submarine, mutiny, russia, missile, nuclear missile, embassy, u.s. navy, battle for power, torpedo, military, moral dilemma, post cold war, aircraft carrier, chain of command, launch code, sonar"
26564,"underground, biography, art"
8068,"gunslinger, anti terror, ambush, mexico, showdown, guitar, nudity, hitman, bartender, revenge, tragic hero, shootout, mariachi, explosion, extreme violence, brutality, drug lord, leg brace, concealed weapon, flashback, bookstore"
8512,"jazz club, murder, los angeles, private detective, film noir, neo-noir"
1572,"bomb, taxi, riddle, robbery, detective, helicopter, gold, subway, ship, fistfight, police, sequel, deception, shootout, new york city, explosion, violence, car chase, fbi agent, simon says, flashback, dump truck, aqueduct, action hero, federal reserve bank"
6520,"camelot, knight, king arthur, excalibur, knights of the round table"
8973,"fanatic, supernatural, wizardry, resurrection, sect, occultism"
2293,"sex, game show, slacker, shopping, mall, ex-boyfriend ex-girlfriend relationship, jay and silent bob, silent man, coke, bandleader, aftercreditsstinger"
1642,"cheating, new identity, computer virus, chase, computer, stalking"
32646,"sex, chemical, medicine, housewife, pollution, quarantine, independent film, allergy, psychiatrist, illness, disorder, retreat, multiple chemical sensitivity (mcs), environmental illness"
281,"pornography, prostitute, rape, police brutality, dream, ex-girlfriend, future, bodyguard, rapper, virtual reality, dystopia, minidisc, police, ex-cop, murder, cyberpunk, los angeles, violence, criminal, private detective, revolt, woman director"
5967,"car mechanic, letter, musical, war, single"
3512,"terrorist, pentagon, satellite, navy seal, train"
65796,"opium, loss of eyesight, biography, sioux, wild bill hickok, calamity jane"
26258,"cave, waterfall, children, mistaken identity, boy scouts leader"
76,"dialogue, sunrise, talking, soulmates, walking, austria, traveller, danube, bittersweet, romantic, vienna"
6715,mississippi
2292,"salesclerk, loser, aftercreditsstinger"
1909,"sex addiction, love, mental institution, patient, psychiatrist, don juan"
8984,"employee, workplace, sexual harassment, intrigue"
4954,"terrorist, transport of prisoners, airplane, parachuting, suspense"
522,"individual, taxi, transsexuality, fortune teller, film business, film making, film producer, vororte, film maker, boxer, film director, oddball, celebrity, morphine, movie studio, los angeles, drug addict, cult director, theremin, handgun, trick or treating, actor, transvestite"
397,"paris, airport, in love with enemy, canadian, necklace, fear of flying, deal, vineyard, smuggling"
1024,"mother, sex, secret, obsession, literature, nudity, fantasy, passion, love, friends, murder, independent film, lesbian, true, relationship"
628,"paris, san francisco, vampire, plantation, pity, bite, fang vamp"
6280,"baby, medicine, media, pregnancy, scientist, science, male pregnancy, fertility, gynaecology, ceasarean birth"
6071,hoodlum
11,"android, galaxy, hermit, death star, lightsaber, jedi, rescue mission, empire, rebellion, planet, smuggler, the force, space opera, galactic war, stormtrooper, totalitarianism"
4476,"brother brother relationship, montana, based on novel, world war i, journey round the world"
32325,"east los angeles, gang, los angeles, poverty, gang member, hispanic, mexican american, girl gang, woman director, cholo, chola"
3036,"human experimentation, frankenstein, remake"
8986,"prostitute, tree house, red-light disctrict, young people, stripper, make a match, mob boss"
1945,"loss of mother, loss of sister, twin sister, autism, lake, kaspar-hauser-syndrom, feral child, forest, north carolina, psychologist, family"
241,"sadistic, journalist, mass murder, yellow press, trauma, daughter, satire, controversy, controversial, violence, young couple, abuse"
527,"individual, slum, suicide, tattoo, alcohol, rape, tradition, loss of child, indigenous, despair, violent husband, ghetto, new zealand, maori, strong woman, lack of prospects, maori tradition, funeral, approved school , crush, independent film, teacher, youth gang, domestic violence, violence, rebellious youth, alcohol abuse, incest, unemployment"
6950,"river, general, research, army, serum, monkey, epidemic, medical research"
101,"new york, corruption, assassin, police brutality, loss of family, s.w.a.t., immigrant, hitman, training, revenge, murder, loneliness, neighbor, tragic love, cult film, neo-noir, complex relationship, complex characters"
2307,"jealousy, burning house, teenage crush, arsonist"
680,"transporter, brothel, drug dealer, boxer, massage, stolen money, crime boss, dance contest, junkyard, kamikaze, ambiguous ending, briefcase, redemption, heirloom, pulp fiction, reference to al green, theft, brutality"
3586,"paris, hotel room, suspicion of murder, mannequin, fashion photographer, sandwich, poodle, reporter, fashion"
110,"judge, isolation, mannequin, shadowing, english channel, geneva, travel, dog"
108,"paris, composer, pain, loss of husband, to compose"
109,"hairdresser, sexual frustration, funeral, business man, poland"
159185,
2636,"explosive, revenge, explosives expert"
2164,"space travel, teleportation, uprising, shot to death, androgyny, space western, outer space, timebomb, death of son, nuclear weapons, invented language, hieroglyph, egyptian mythology, egyptology"
278,"prison, corruption, police brutality, prison cell, delinquent, parole board, escape from prison, wrongful imprisonment, framed for murder, 1940s"
193,"based on tv series, death, exploding planet, mountain cabin, solar system"
95963,"vietnam, jungle, black american"
1587,"brother brother relationship, mentally disabled, iowa, widow, dysfunctional family, independent film"
2064,"brother brother relationship, chicago, coma, subway, love of one's life, brother, man of one's dreams, hospital"
236,"individual, becoming an adult, dream, return, love of one's life, overweight, province, bathing, olympic games, empowerment, boredom, daughter, friendship"
3049,"dolphin, mascot, private detective, pets"
2759,"gay, drag queen, homophobia, musical, van, australia, transgender, australian aborigine"
888,"manager, jealousy, bad mother-in-law, adoption, family's daily life, stone age, plan, friendship, best friend, dinosaur"
13,"vietnam veteran, hippie, mentally disabled, running, based on novel, vietnam, vietnam war, friendship, love, family relationships, bully, mother son relationship, military, hugging, shrimping, wounded soldier, flashback, park bench, amputee"
712,"upper class, love at first sight, wedding vows, marriage proposal, yuppie, love of one's life, lone wolf, snob, witness, bride, bridegroom, bridesmaid, funeral, clumsy fellow, friendship, wedding, gay couple"
8587,"loss of parents, wild boar, uncle, shaman, redemption, king, scar, hyena, meerkat"
1689,"buddhist, tibet, reincarnation, buddha, siddhartha, independent film"
854,"dual identity, bank, mockery, green, balloon, jail cell, norse mythology"
2788,"roommate, yuppie, generations confilct, camcorder, cohabitant, cabriolet, fictional tv show, unemployed"
8987,"river, robber, boston, bank robber, marriage crisis, hostage-taking, rafting, criminal, white water rafting"
8831,"martial arts, time travel, science fiction, alternative reality"
315,"killing, sports car, go-go dancer, eroticism, kidnapping, independent film, b movie, exploitation film"
8011,"japan, new york, scotland, morocco, good and bad"
171857,
2654,"small town, paranoia, new hampshire, insanity, suspense, h.p. lovecraft, diner, author, disappearance, church, violence, gothic, crucifix, new england, insurance investigator, ghost town, publisher, horror novel"
2758,"jealousy, baby, brother sister relationship, butler, yuppie, nanny, summer camp, guillotine, uncle"
306,"detective, undercover, security camera, carousel , investigation, weapon, sequel, rescue, counterfeit, shootout, dirty cop, gunfight, los angeles, explosion, violence, foot chase, framed, car chase, secret service, amusement park, roller coaster, beverly hills, buddy comedy"
26203,"killer, blindness"
178,"terrorist, boston, fireworks, orchestra, anarchist, concert, computer, revenge, irish, wedding, explosion, violence, roulette wheel, capsized ship, belfast, bomb planting, headphones, flashback, bomb attack, blast, human bomb"
4722,"distrust, military base, remake, alien, escape, soldier, alien invasion, alien infection, sleeping, doppelganger, emotionless"
26391,
117553,"male nudity, tattoo, california, father son relationship, beach, radio, narration, con man, nostalgia, calendar, cops, party, stolen money, domestic abuse, stalking, coming of age, diner, marijuana, hollywood, summer, movie star, stolen cars, practical joke, military enrollment, small time thugs, movie clips, live life to the fullest, fictionalized biography"
6075,"prison, 1970s, puerto rican, release from prison, criminal past, love, night club, violence, drug, disco"
2124,"suicide, california, sex, secret identity, eroticism, paranoia, nudity, group therapy, therapist, grief, obsessive compulsive disorder, violence, psychiatrist, car chase, disguise, mental illness, color blindness, voyeurism"
49299,"independent film, drug, divorce, filmmaking, psychological drama"
26141,"spoof, private detective"
5503,"chicago, showdown, undercover, surgeon, death sentence, doomed man, lethal injection, chase, remake, betrayal, on the run, train crash, escape, fugitive, based on tv series, u.s. marshal, doctor, explosion, home invasion, disguise, one armed man, framed for murder, flashback, corrupt cop, manhunt, bus accident, storm drain"
2087,"suicide by hanging, sexual torture, exploding truck, cuckold, garbage dump"
4916,
2019,"new orleans, mercenary, hunting human beings, money, drifter, union, sailor, human prey"
26271,"sleepover, independent film, best friend"
2259,"central and south america, farm worker, farm, coup d'etat, santiago, paranormal phenomena, domestic violence, estate, family estate"
7984,"bomb, prison, father son relationship, based on novel, 1970s, biography, faith, irish, trial, rebellion, torture, terrorism, courtroom"
6,"chicago, drug dealer, boxing match, escape, one night"
329,"exotic island, dna, paleontology, tyrannosaurus rex, triceratops, brontosaurus, electric fence, island, dinosaur, amusement park, theme park, jurassic park"
507,"paris, prostitute, robbery, drug abuse, aids, bank, jazz, hostage, night life, kidnapping, vault, junkie, bank robber, heroin, friendship, murder, independent film, pistol, violence, drug, bank robbery, illegal prostitution, hoodlum"
1413,"china, opera singer"
2246,"married couple, insurance fraud, boarder, suspense, child wish"
2320,"bomb, ransom, hostage, airplane, hijacking, terror cell, special unit, deception, rescue, covert operation, disaster, shootout, terrorism, explosion, violence, surveillance, night vision goggles, flight attendant, intelligence agent, flashback, hand to hand combat, nerve gas"
5879,"japan, jealousy, brothel, nudity, passion, longing, geisha, deceived wife, castration, strangle, independent film, unsimulated sex, prostitution, erotic 70s"
2625,"depression, therapist, symphony, piano, psychiatrist patient relationship, bipolar disorder"
788,"san francisco, parent child relationship, restaurant, nanny, mask, custody battle, fake identity"
713,"love triangle, scotland, mother, adultery, sexuality, jealousy, culture clash, isolation, eroticism, strangeness, penalty, violent husband, new zealand, maori, arranged marriage, piano lessons, settler, wilderness, deceived husband, marriage, secret love, woman director"
8291,"loss of lover, sadness, los angeles, road movie"
1245,"newspaper, butler, country house, loyalty, flower, nazis, jewish, britain, housekeeper, employer"
7007,"japan, usa, corruption, detective, journalist, based on novel, japanese, restaurant, wheelchair, parking garage, company, police, party, murder, whodunit, seppuku, bulletproof vest"
5550,"cyborg, dystopia, police, sequel, cyberpunk, policeman, robocop"
2088,"police operation, sex addiction, police, mafia boss, suspense, bad cop, hitwoman"
424,"factory, concentration camp, hero, holocaust, world war ii, nazis, defense industry, biography, the holocaust"
103413,"suicide, social worker, village, orphanage, orphan, small village"
8850,"new york, atomic bomb, ladykiller, hypnosis, superhero, based on comic, radio series, invisibility, the shadow"
695,"suicide, loss of son, helicopter, cheating, fishing, daily life, jazz musician, modern society, cellist, earthquake, los angeles"
858,"father son relationship, lovesickness, journalist, loss of mother, loss of lover, radio station, christmas party, love of one's life, radio, seattle, baltimore, fiancé, radio presenter, airplane, radio transmission, observation deck, friendship, unsociability, woman director"
867,"new york, sex, based on novel, eroticism, hidden camera, video surveillance, psychopath, murder, neighbor, stalking, landlord, female protagonist, drug use, sex talk, apartment building, landlord tenant relationship, mind game, erotic thriller"
78,"artificial intelligence, bounty hunter, dystopia, genetics, fugitive, cyberpunk, los angeles, tech noir, neo-noir, futurista, lluvia"
319,"father son relationship, film producer, mexican standoff, loss of father, cocaine, love, mafia, los angeles, drug, illegal prostitution, gun violence"
32562,"gay, cinema, media, lesbian, hollywood, lgbt, lgbt history"
124304,"dwarves, small town, widow, argentina, woman director"
771,"holiday, burglar, home invasion, mischief, booby trap, home alone, suburban chicago, mischievous child, christmas, child"
251,"corruption, fortune teller, money transfer, money laundering, pottery, afterlife, spiritism"
812,"magic, musical, cartoon, princess, love, comedy, animation, monkey, arab, aftercreditsstinger, genie, animal sidekick"
280,"cyborg, shotgun, post-apocalyptic, dystopia, moral ambiguity, mental institution, violence, fictional war, morphing, nuclear weapons, shape shifter, savior, catch phrase"
581,"skab under tv, Øverste hylde, foran"
80350,"cia, amnesia, drug smuggling"
268,"double life, dc comics, dual identity, chemical, crime fighter, fictional place, gotham city, superhero, super powers"
274,"based on novel, psychopath, horror, suspense, serial killer, psychological thriller, cannibal, fbi agent, animal in cast credits, cannibalism"
408,"poison, witch, becoming an adult, sadness, queen, attempted murder, dying and death, appearance, princess, candlelight vigil, snow white"
114,"prostitute, capitalism, cinderella, expensive restaurant, sports car, workaholic, fire escape, friendship, los angeles, piano"
576,"underdog, robbery, bounty hunter, texas, mexican revolution, friendship, honor, gang, shootout, soldier, steam locomotive, righteous rage"
124472,woman director
7300,"skab under tv, bagved, Øverste hylde"
275,"cheating, ransom, salesclerk, winter, kidnapping, auto, unsociability, police, north dakota, murder, money, car dealership, woodchipper"
8766,"artificial intelligence, engineer, hell, pinhead, demon, puzzle box, cenobites, artificial"
4307,"spain, madrid, suicide attempt, mother daughter relationship, novelist, old woman"
1592,"corruption, bishop, court case, pornographic video, court, psychopathy"
38884,"spain, solidarity, fascism, revolution, communist, worker, spanish civil war, anarchist, franco regime, marxism, betrayal, working class"
2021,"london england, depression, baby, nanny, daughter"
954,"paris, london england, spy, cia, terrorist, secret identity, undercover, arms deal, headquarter, secret base, secret mission, prague, embassy, secret agent, tgv, computer, mission, based on tv series, espionage, agent"
8840,"magic, kingdom, despot, immortality, village, forest, army, horror, partner, revenge, knight, battle, medieval, dragonheart"
124625,
161070,"wales, rural setting, older woman younger man relationship"
5801,"robbery, move, monsoon, difficult childhood, dying and death, misery, priest, teacher, writer, railroad, unemployment, help"
896,"broken engagement, arranged marriage, dying and death, calcutta"
3065,"tastelessness, film and cinema, based on tv series, spoof, robot, scientist"
2300,"sport, basketball, doctor, basketball team, basketball game, referee, basketball court, tweety bird, speedy gonzales, cartoon chicken, sylvester the cat, cartoon reality crossover, basketball hoop, cartoon skunk"
8069,"sexual fantasy, alien planet, distant future, cult classic, female mercenary"
27768,independent film
33245,"gay, aids, terminal illness, hiv, death, lgbt history"
38867,"paris, sex, jealousy, infidelity, secret, world war ii, nudity, writer, soldier, violence, extramarital affair"
753,"prostitute, adultery, suicide attempt, nudity, marriage crisis, love, independent film, divorce"
8866,"radio presenter, false identity, decoy, beguilement, love, art"
922,"sheriff, bounty, bounty hunter, gun, attempted murder, prosecution, illness and injury, dying and death, frontier, murder, black and white, 19th century, fear of dying, wanted dead or alive"
73183,
664,"wife husband relationship, tornado, twister, oklahoma, metereologist, invention, climate, barn, natural disaster, cow, truck, disaster, aunt niece relationship, storm chaser, divorce"
532,"prison, inventor, loyalty, sheep, innocence, surrealism, framed, dog, sheep rustling, wallace & gromit"
26744,"numbers racket, film noir"
935,"usa president, general, cold war, strategic air command, nuclear missile, war room, bomber pilot, nuclear weapons, ex nazi, doomsday device, absurdism"
7095,"age difference, appearance, body exchange, genetics"
124633,"yugoslavia, immigration, american dream, serbia"
627,"london england, alcohol, sex, based on novel, drug addiction, drug dealer, nightclub, junkie, heroin, cold turkey, modern society, hallucination, friendship, surrealism, dark comedy, stealing, monologue, cult film, recovering drug addict, illegal drugs, drug deal, drug rehabilitation, drug culture, antihero"
602,"spacecraft, patriotism, countdown, independence, invasion, war, ufo, extraterrestrial, spaceship, alien, battle"
81949,
124306,
1645,"ku klux klan, rape, mississippi, jurors, blackmail, attempted murder, forgiveness, court, shooting, murder, suspense, lawyer, trial, courtroom, racial tension, kkk, racial issues, courtroom drama"
34170,
124645,
151489,poet
4837,menage a trois
2925,"divorce, divorced woman, reunited friends"
3595,"bounty, loss of child, yellow press, fbi, baby-snatching, suspense, fbi agent, millionaire"
3573,"skab under tv, Øverste hylde, foran"
124619,
144982,"bartender, grifter"
47907,"prison, small town, independent film, church"
549,"new york, sex, drug abuse, homeless person, new love, drug addiction, overdose, graffiti, street art, vernissage, exhibit, friendship, independent film, drug, celebration"
145925,
238,"italy, love at first sight, loss of father, patriarch, organized crime, mafia, lawyer, italian american, crime family, rise to power, mob boss, 1940s"
159,"transvestism, gay, male nudity, sexual identity, cologne, drag queen, support group, heterosexual, diashow, waitress, infidelity, friendship"
88224,"sex, robbery, runaway, dream, kidnapping, sister, police, pregnant, teenager, drug, woman director"
58770,"riot, blackout, power outage, sick child"
124851,
3587,"circus, magic, aunt, imaginary friend"
26933,"love triangle, gay, province, algerienkrieg, french, homosexuality, gay relationship, coming of age, in the closet, gay sex, gay man, heartbreak, lgbt, lgbt teen, broken heart"
981,"philadelphia, photographer, strong woman, swimming pool, remarriage, hangover, reporter, divorcee, socialite, ex-husband ex-wife relationship, high society, fiancé fiancée relationship, divorced couple, family estate, inebriated, imminent wedding, kid sister, love quadrangle"
