movieId,keywords
7453,"bureaucracy, android, based on novel, chase, space travel, galaxy, alien, stop motion, survival, hitchhiker, robot, alien invasion, hyperspace, meaning of life, destruction of earth, intergalactic travel, islington england"
6183,"dysfunctional family, relationship, psychiatry, mental health, road movie, mental hospital"
8220,"nun, drug, monastery, catholic church"
30863,
8976,"new york, shyness, career, flight, romantic comedy, travel, male female relationship, los angeles"
27360,"caper, action"
1495,"crusade, epic, knight, swordsman, order of the templars, religious, knight templars, saladin, king richard"
1640,"race politics, daughter, installer, police, fall, car crash, racism, los angeles, bigotry, social services, collision"
43260,"ranger, wagon train, bar shootout"
26614,
26810,woman director
1566,"war crimes, small town, bridge, u.s. army, firearm, dead soldier, shot in the back, steel helmet, shot to death, teenage boy, american abroad, nazi soldier"
37720,holland
2444,"suicide attempt, amnesia, lie, macho, passion, rock, motorcycle"
1279,"prostitute, double life, repayment, pimp, expiation, forgiveness, dying and death, punter, female friendship, daughter, revenge, violence, police officer, illegal prostitution, car, catholicism, child sex trade"
1895,"showdown, death star, vision, cult figure, hatred, dream sequence, expectant mother, space opera, chancel, childbirth, galactic war"
4379,"bad mother-in-law, surgeon, dogsitter, falling in love"
85014,
27,"london england, female nudity, sex, rock and roll, blow job, condom, safe sex, concert, erection, fellatio, pubic hair, sexual fantasy, penetration, sexual intercourse, ejaculation, unsimulated sex, couple, desire, semen, vulva, male orgasm, penis, explicit sex"
953,"lion, hippopotamus, giraffe, penguin, zebra"
26825,"father son relationship, film making"
921,"transporter, netherlands, world cup, socially deprived family, family's daily life, boxer, boxing match, comeback, training, heavy weight, folk hero, biography, daughter, defeat, sport"
787,"bomb, assassin, secret identity, secret, assault rifle, gun, married couple, hitman, decoy, marriage crisis, marriage, job, dysfunctional marriage, gunfight, bullet wound"
3011,"love triangle, neighbor"
272,"himalaya, martial arts, dc comics, crime fighter, secret identity, undercover, hero, loss of father, society, gotham city, vigilante, superhero, based on comic, rivalry, tragic hero, ninja, good vs evil, crime, super powers, haunted by the past, evil doctor, escapade, master villain, fighting crime, unfulfillment, love and romance, unfulfilled love"
5845,"swordplay, katana"
2287,"street gang, hip-hop, dance, fight, breakdance, ghetto, musical, clowning, gang, los angeles"
2994,"anti hero, police, based on comic, heist, money, police inspector"
1382,"brother brother relationship, playground, independent film, sex talk, art gallery, separation, self mutilation, shoe salesman, chat session, female artist, meeting on the internet, hope chest, woman director"
276,"sex, ransom, hostage, revolution, nudity, girlfriend, love, friends, debt, burglary, mansion, relationship, crime, political, boyfriend, messages, evicted"
93775,"runaway, wedding, running away"
38046,"infection, spaceship, lethal virus"
2151,"operation, taxi driver, face operation, comic book, bulgaria, head injury, chief executive officer, independent film, doctor"
42491,"bondage, fort, apache, native american attack, racism, pistol, massacre, violence, cavalry, u.s. cavalry"
102841,
26323,"casino, police, murder, film noir"
115565,"dream, adoption, nudity, investigation, murder, inheritance, writer, gangster, twins, discovery, european, mental"
2095,"hitman, wilderness, suspense, fbi agent, white woman"
26762,"revenge, suspense, mafia, ex-con"
74,"post traumatic stress  disorder, new jersey, airplane, dystopia, daughter, apocalypse, alien invasion, human subjugation"
4889,"england, spy, texas, cold war, anti-communism, swinging 60s, supercomputer, harry palmer, finland"
1667,"parent child relationship, penguin, brood, autonomy, egg, survival, snow, antarctic"
100196,small town
7233,"trainer, college, training, sport, basketball, school"
78344,
9009,"based on novel, water, remake, teacher, divorce, apartment, ghost, manhattan, new york city"
1553,"paris, father son relationship, loss of mother, estate agent, chinese woman, piano lessons, piano teacher, squatter, classical music, concert, pianist, piano"
1826,"paris, london england, sex, screenplay, screenwriter, ex-girlfriend, boat wedding, st. petersburg russia, ship, ballet dancer, independent film, ballet, author, wedding"
36401,
1635,"clone, transplantation, love of one's life, dystopia, genetics, freedom, escape, cloning, plague"
1696,"sadistic, killing, fire, sheriff, bounty hunter, cocaine, motel, ax, sadism, psychopath, road trip, sequel, murder, rampage, antisocial personality disorder, serial killer, shootout, torture, corpse, sadist, extreme violence, brutality, maniac, violence, stabbing, killing spree, held at gunpoint, cult film, roadkill, macabre, misogynist, road movie, killer clown, painted face, evil clown, homicidal maniac, sadistic horror"
1665,"sex, seattle, nudity, musician, song, rock, woods, independent film, singer, true, mansion, recording"
72899,"music, historical figure, homosexuality, hipersexualidad"
5237,"sex, adultery, fire, allegory, isolation, dream, wind, sandstorm, mythology, nudity, nightmare, hallucination, surreal, underwear, wilderness, south africa, ritual, supernatural powers, supernatural, namibia, stranded, surrealism, sexploitation, broken neck, explosion, demon, desert, extramarital affair, cult film, supernatural being, occult, ritual murder, director cameo, dream sequence, shape shifter, dust storm, occult ritual, phantasmagoria, desolation, african mythologhy, sex with a god, desert wind, emptiness, vastness, ritual killing, dust devil"
308,"bachelor, ex-boyfriend, ex-girlfriend, anonymous letter, midlife crisis, amateur detective, it-expert, veterinarian, unsociability, independent film"
5319,"tradition, love of one's life, hindu, faith, hinduism, singer"
27449,"paris, ambition, friedrich nietzsche, new york city, pre-code, speakeasy, golddigger"
85783,"has been, movie star, screen test, past prime"
6519,"sheriff, farm, bikini, redneck, moonshine"
25956,"ransom, money, drug"
1444,"dysfunctional family, dysfunctional marriage, independent film, pregnancy, in-laws, art dealer, sister-in-law, daughter–in–law, newlyweds"
8292,"brother brother relationship, robbery, arbitrary law, adoptive mother, revenge, murder, violence, detroit, duringcreditsstinger, interracial adoption"
501,"life and death, camping, rain, camcorder, self-abandonment, grizzly bear, non-governmental organisation, human animal relationship, fox, biography, unsociability, katmai national park, alaska, animal rights, wildlife, ecology"
27292,"female nudity, corruption, chase, collector, field, farm, revenge, murder, suspense, independent film, kansas city, extortion, drug dealing, business, prostitution, gangster, violence, cornfield, hot dog, white slavery, fairground, off screen rape, small community, meatpacking, county fair"
25975,"obsession, camcorder, crush, dream girl"
27217,"sexual abuse, fisherman, dysfunctional family"
53857,"london england, butler, charity, gang, woman director, confidence man"
52660,"made for cable tv, gremlin, gangster, private detective"
6957,"first time, virgin"
1917,"nurse, suspicion of murder, surgeon, hospital, killer"
79684,"world war ii, contraband"
445,"paris, upper class, puberty, anonymous letter, suppressed past, massacre on french algerians 1961, confidence, moderator, camcorder, menace, lie, algerian, videoband, intellectual, conscience"
4442,"brother brother relationship, literature, aftercreditsstinger"
1985,"aids, diplomat, nairobi, politician, pharmaceutical industry, cancer, morgue, genocide in rwanda"
9007,"coma, based on novel, workaholic, flirt, architect, romantic comedy, ghost, landscape architect"
1830,"cold war, weapon, arms dealer"
7182,"louisiana, voodoo, swampf, escape, youth"
340,"grandfather grandson relationship, mass murder, ukraine, pop culture, blindness and impaired vision, journey in the past, passion for collection, souvenir, nazis, anti semitism, photograph"
1546,"becoming an adult, thumb, first time, hypnosis, thumb sucking, attention deficit hyperactivity disorder (adhd), elocution, high school, independent film, teenage crush, youth, family"
51277,"daughter, wanderer"
1676,"bath, horse, cabin, stetson, beef, shootout, bullet wound, cowboy, cattle ranch"
26259,"kung fu, showdown, hero, kidnapping, warrior woman, fistfight, waterfall, forest, murder, gore, blood, tough girl, monastery, heroine, inn, severed hand, wuxia, kung fu master, inner strength, beggar clan, tavern fight"
77744,"philadelphia, socialite"
8814,"teleportation, based on video game, severed ear, future war, wisecrack humor, commando mission"
8202,"martial arts, dystopia, surrealism, based on cartoon, shootout, espionage, infertility, cyberpunk, extreme violence, sabotage, one against many, woman director, hand to hand combat, action heroine, human cloning, 25th century"
3118,frankenstein
2125,"prisoner, future, escape, blast"
1947,"loss of son, sheriff, wyoming, grandfather granddaughter relationship, violence against women"
49220,
8643,"epilepsy, possession, teenage girl, spirit, umbrella, cross, prosecutor, catholicism, negligent homicide, archdiocese, agnostic, malnutrition, burning, psychotic epileptic disorder"
3933,"shyness, england, cheating, old town, grave, skeleton, musical, marriage, wedding ring, stop motion, animation, money, wedding, corpse, wedding ceremony, parents, dark fantasy, european, ring, piano"
8923,"police brutality, harvard university, sport, hooligan, student, soccer, cruelty, american, violence, woman director, firm, west ham united"
59,"robbery, double life, dual identity, small town, indiana, distrust, fight, self-defense, marriage, family relationships, mistaken identity, diner, lawyer, mobster, violence, attempted robbery"
257,"london england, child abuse, street gang, runaway, child labour, children's home, orphanage, thief, violence, good and bad, child"
398,"gay, self-fulfilling prophecy, based on novel, journalism, identity, dream, literature research, literature, dying and death, biography"
647,"megacity, swordplay, wheelchair, airplane, based on video game, ruins"
349,"holiday, france, male nudity, portugal, father son relationship, sexual identity, sex, sea, lovesickness, aids, sunrise, jealousy, infidelity, new love, eroticism, sun, coming out, virtue, plumber, shower, mobile phone, dutch, mistral, breakfast, quickie, cruising, longing, friendship, crush, motorcycle, youth, gay sex, masturbation, lgbt"
27176,woman director
533,"competition, garden, vegetable, stop motion, animation, contest, dog, rabbit, pest control, giant vegetable, wallace & gromit"
5236,"detective, loser, custody battle, shooting, thief, crush, los angeles, series of murders, celebration, hoodlum, female corpse, christmas"
5471,"hero, mythology, nordic mythology, mythical creature, viking, weapon, swordsman, mythological beast, norse mythology, sword and sorcery"
1559,"bizarre, beauty queen contest, independent film"
3527,
27759,"siege, epic, beijing"
26513,"hippie, dystopia, mockumentary, soldier, violence, desert, military, hostile, aggressive"
38583,
77468,
142,"gay, countryside, homophobia, loss of lover, wyoming, rodeo, father murder, horseback riding, intolerance, daughter, marriage crisis, secret love, cowboy, star crossed lovers"
45899,infertility
3291,"telecaster, communist, political activism, tv show, politician, government, anti-communism"
791,"prophecy, fire, sea, beach, cemetery, gold, small town, beheading, sword, penalty, narration, fog, leprosy, ship, ghost ship, lighthouse, weather service, unatoned crime, mother daughter relationship, killer, denunciation"
2610,salesclerk
1656,"california, spy, father son relationship, mexico, hero, marriage crisis, sword fight, divorce, american civil war"
41566,"new york, punk, the bowery, jetboy"
6963,"new york, chicago, midlife crisis, television, daughter, father, weatherman, terminal illness, wettermann"
215,"riddle, serial killer"
2313,"new york, date, lovesickness, jewry, jealousy, age difference, photographer, love of one's life, jewish life, nightclub, artist, therapist, kiss, blond, child wish"
5335,"italian, household, independent film, gay man, stranger, visitor"
25918,"brother brother relationship, boxer, boxing match, sport, classic noir"
3554,"slum, chicago, rome, ghetto, mannequin, supermodel"
1951,"southern usa, slavery, duringcreditsstinger"
25763,"based on novel, future, post-apocalyptic, war, cockroach, motorcycle, scorpion, post nuclear, battle for survival"
259,"paris, adultery, bookshop, print shop, printer, cemetery, 1970s, becoming an adult"
25,"sniper, marine corps, saudi arabia, petrol, golf war, u.s. marine"
105299,"murder, dark comedy, lust, siblings relations"
5620,"dracula, blood, gothic horror"
231,"anti terror, bomb, assassination, middle east, lebanon, cia, capitalism, globalization, loss of son, persia, war against terror, energy policy, petrol"
8999,"prison, chicago, rape, based on novel, hotel room, wife husband relationship, anonymous letter, blackmail, family's daily life, letter, business man, relationship problems, man between two women, revenge, deception, beating, violence, wallet, extramarital affair, embezzlement, advertising executive, flashback, abortion, commuter train"
4348,"bachelor, beautiful, prejudice, suitor, period drama, georgian, pride, 18th century, opposites attract"
47540,suspense
674,"magic, dying and death, broom, sorcerer's apprentice, school of witchcraft, chosen one, black magic, boarding school, vision, tournament, teenager, wizard, teenage hero, based on young adult novel"
69,"germany, prison, music record, adultery, country music, guitar, loss of brother, concert, marriage, single, accident, 1960s"
1833,"gay, sex, aids, musical, hiv, based on play or musical, african american, rock opera, missing person, hiv positive, home movie, mugging, telephone call  , lower east side"
65045,
6795,"adventure, house, alien, giant robot, outer space, astronaut"
7301,"sexuality, parent child relationship, indiana, anti hero, melancholy, brother, uncle"
1420,"transvestism, london england, gay, transsexuality, travestie, loss of mother, 1970s, pastor, homosexuality, pregnancy, ireland"
9005,"nudity, strip club, stripper, crook, ice storm, murder, betrayal, escape, mobster, gangster, killer, alcohol abuse, christmas eve,  wichita kansas"
7010,"africa, kidnapping, mercenary, diplomat, private army, outlaw"
6529,"apache, native american, military officer, cavalry, 19th century"
3124,"castle, frankenstein, mad scientist, hammer horror"
8425,"paris, father son relationship, 1970s, kommissar geiger, murder hunt"
2153,"auto, gritty"
116,"love triangle, london england, upper class, adultery, tennis, river thames, love, wealth, lust, instructor, gold digger, social climbing, actress"
5741,"sex, adultery, nudity, lust, violence, criminal, desire"
84090,"wales, doctor, mining town"
67,"individual, terror, civil war, israel, palestine, middle east, muslim, middle east conflict, friendship, suicide mission, unemployment"
411,"saving the world, witch, based on novel, brother sister relationship, self sacrifice, winter, cupboard, beaver, lion, fairy-tale figure, battle, narnia, fantasy world, duringcreditsstinger"
254,"film business, screenplay, show business, film making, film producer, exotic island, monster, indigenous, ship, dinosaur"
1904,"japan, prostitute, sister sister relationship, brothel, world war ii, geisha"
2008,"servant, emperor, battle assignment"
27031,"samurai, jidaigeki"
917,"mother, hunger, bodily disabled person, physical work, rage and hate, pride and vanity, aridity, musical, peasant, interest, field, praise"
92272,policeman
84847,"prostitute, sailor"
2777,"prostitute, seoul"
8290,"paris, world war ii, british, paratroops, french resistance, nazi occupation"
612,"paris, assassination, israel, hotel room, 1970s, hostage, intelligence, olympic games, munich, mossad, israeli, palestinian, beirut, ailul al aswad, plo, bomb constructor, baader-meinhof group, olympian village, revenge"
546,"individual, gay, new york, usa, missionary, father son relationship, sexual identity, transsexuality, runaway, sexual abuse, waitress, parent child relationship, drug addiction, cocaine, women's sexual identity, hustler, new identity, motel, therapist, porn actor, road trip, independent film, los angeles, transgender, stolen cars, hitchhike"
2800,"ladykiller, daughter, family secrets, extramarital affair"
4495,"beehive, baby-snatching, spanish civil war, frankenstein"
33081,
43899,"step father, orphan"
107667,
6935,parkour
60566,"lost civilisation, scientific expedition, treasure hunter, eternal life"
4550,independent film
6934,"aids, mine, south africa, dying and death, johannesburg, infection, kral, independent film, school"
174865,"disguise, club, kleptomaniac"
1690,"bathroom, sex, amsterdam, europe, brothel, slovakia, backpacker, horror, gore, blood, torture, business card, doberman, hostel, surgery, elite club, fingers"
834,"budapest, key, vampire, light, werewolf, evolution, fang vamp"
25890,simulated reality 
26782,based on novel
27742,"psychic, doppelganger, haunt"
72856,"musical, brother, preacher, all black cast"
4772,"age difference, island, married couple, refrigerator"
2455,"detective, clerk"
43626,
27344,"swamp, b movie"
7295,"budapest, hungary, blackmail, porno scene, unsimulated sex, sex party"
2117,"resistance, death penalty, munich, biography, white rose, flyer, guillotine, nazi germany, gestapo, nazism, anti-nazi, 1940s"
47250,"prison, prison cell"
1969,"mexico, bank robber, revenge, best friend, bank robbery, bank vault, steam locomotive"
97936,"key, romance"
17,"suicide, paradise, child abuse, sea, adolescence, wales, secret, underworld, shepherd, loss of child, sheep, single, mother daughter relationship, sect"
45726,psychotic
33117,"dancer, musical, wealth, heiress, stock market crash"
31894,"fighter pilot, training, aviation, african american"
86168,"father son relationship, singer, mother son relationship"
30712,"prison, fbi, train, prison break"
292,"black people, hip-hop, block party, megaphone, classroom, brass band, stage"
77291,"carnival, violence"
1544,"london england, flower shop, homosexuality, lesbian, lgbt"
1651,"exotic island, secret, love of one's life, plantation, marriage, mail order bride, french noir"
33799,woman director
5145,"hit-and-run driving , hit and run"
7304,"ice hockey, racism, pedophile, throat slitting, shot in the stomach, head blown off, police investigation, pistol whip, shot in the shoulder, child uses gun, ankle holster, breaking finger"
2207,"mission of murder, male bonding, doing the right thing, people change"
6877,"hotel mom, romantic comedy, lying, living with parents, pretend relationship"
950,"mammoth, sloth, ice age, barrier ice, ice melting, iceberg, flooding, adventure, lovers, deluge, saber-toothed tiger"
4173,
7483,"terror, israel, car journey, middle east conflict, war, jordan, border crossing, break-up, road movie"
1967,"italy, mexico, alcohol, sex, beach, nudity, passion, cigarette, letter, kiss, police, love, racism, los angeles"
752,"detective, vatican, fascism, satanism, fascist, dystopia, government, chancellor, revenge, personification of satan, torture, hatred, masked vigilante, catholicism, catholic priest, catholic guilt, jesuit, vengeful spirit, activist, irish catholic, vengeful, jesuit priest, gnosticism, occultism"
388,"bank manager, kidnapping, nazi background, document, ultimatum, court case, heist, financial transactions"
868,"slum, baby, fight, nudity, leader, johannesburg, police, love, friends, murder, gang, teenager, violence, criminal, hijack"
25874,"africa, lion, future, story teller, hallucination, virtual reality, tramp, stranded, alternate dimension, spaceship, lioness, end of the world, alien planet, survival, rocket crash, vision, multiple time frames, eutanasia"
114875,"salesman, cheating husband"
1379,"prison, night watchman, helsinki, love of one's life, despair, loser, friendship, unsociability, teacher, wrongful arrest"
582,"germany, berlin, suicide, berlin wall, corruption, german democratic republic, stasi, blackmail, cold war, soviet union, nudity, propaganda, freedom of speech, house search, artists' life, spying, arts, government, interrogation, surveillance, minister for education, heartbreak, east germany, communism, mfs"
52885,
1561,"suicide, alibi, discontentedness and displeasedness, rage and hate, poacher, policeman, humiliation"
186,"assassination, assassin, identity, sniper, mistake in person, jew, gangster boss, gambling debts, boss, murder, sniper rifle, fbi agent, horse racing, gambler, slevin, caso, hoodlum, black men"
8410,"extraterrestrial technology, alien, independent film"
219,"child abuse, rape, fire, sexual abuse, madrid, secret, return, solidarity, village, superstition, crime, death, ghost, abusive father"
3093,"male nudity, sex, legs, soho london, playing god, jacuzzi"
460,"berlin, berlin wall, brother brother relationship, farewell, father son relationship, casino, loss of mother, parent child relationship, wife husband relationship, billard, culture clash, life planning, jewish life, daughter, marriage crisis, single, relationship, extramarital affair"
8998,"midlife crisis, marriage, money, divorce, fashion, woman director"
44947,
34193,"magic, alter ego, ventriloquist, evil doll, high school sweetheart, ventriloquist dummy"
4441,"junkie, methadone programme, heroin, artist, cold turkey, mental breakdown, lovers, australia, drawing and painting, marriage"
84954,"trauma, dream interpretation, mental illness"
26514,
4257,"haunted house, alien life-form, riesen-ipod"
2652,"suicide, rape, age difference, photographer, ice, shower, menace, lie, pedophilia, manipulation, bedroom, sadism, electric shock, coffee shop, castration, insanity, vigilante, sociopath, deception, neighbor, teenage girl, crying, torture, sadist, pedophile, cruelty, older man younger woman relationship, one day, justice, drinking, rooftop, held captive, mental illness, threat, sexual torture, screaming, electrical torture, childhood sexual abuse, photo studio, verbal abuse"
1629,"paris, roommate, discussion, politics, independent film, communism, may 68"
5820,"usa president, agent"
588,"monster, mother role, burning of witches, fog, suffering, darkness, sadism, supernatural, revenge, surrealism, gore, survival, good vs evil, blood, another dimension, torture, creature, violence, demon, witch burning, based on video game, dismemberment, religious fanatic, ghost town, sleepwalking"
1557,"spy, german democratic republic, cold war, cocaine, hacker, psychology, court case, kgb, hannover, computer, delusion, based on true story, conspiracy theory, hospital, best friend"
8982,"buddhism, elephant, sydney, australia, fighter, tempel, gang, animal"
956,"berlin, cia, vatican, white house, secret identity, secret, explosive, mobile phone, map, traitor, mask, honeymoon, shanghai, pretended murder, secret mission, letter, funeral, covered investigation, to shoot dead, secret agent, video, stamp, hard drive, e-mail, decipherment, suitcase, computer, revenge, murder, mission, hospital, duel, disguise, celebration, good and bad, research laboratory, blast"
1416,"rape, sea, loss of lover, brother sister relationship, border, mistake, weapon, insanity, murder"
560,"new york, post traumatic stress  disorder, mexico, single parent, jealousy, clerk, love of one's life, architect, honeymoon, psychoanalysis, room, neurosis, lilac, sigmund freud, fetishism"
5717,"new york, father son relationship, cat, skyscraper, night life, despair, nightclub, immigrant, coffee, donut, pop star, dying and death, night, shortage of money, pakistani, tape, alone, snack bar, loneliness, independent film, money, falling in love, city, renovation"
503,"new year's eve, fire, drowning, cataclysm, loss of father, atlantic ocean, ball, self-abandonment, shipwreck, giant wave, blackout, ship, daughter, single, escape, capsized ship"
591,"paris, holy grail, christianity, monk, based on novel, zurich, secret society, louvre, curator, symbologist, opus dei, heresy, mona lisa, freemason, conspiracy, pentagram, tomb, catholicism, cryptologist, iconography, albino, sect"
920,"car race, car journey, auto, route 66, wrecker, porsche, retirement, media, friendship, sport, rural setting, anthropomorphism, los angeles, road movie, aftercreditsstinger, duringcreditsstinger"
101908,
26116,
806,"monk, father son relationship, prophecy, ambassador, nanny, devil's son, birthmark, omen, aggression by animal, photography, murder, hospital, pentagram, cowardliness, church, demon, death, archaeologist, good and bad, catholicism, catholic priest"
2044,"chicago, writing, architect, future, time, architecture, mysterious letter, near future, first kiss, romantic drama, passage of time"
350,"paris, journalist, journalism, world of fasion, fashion journal, assistant, job entrant, job interview, editor-in-chief"
58,"witch, fortune teller, bondage, exotic island, monster, captain, card game, east india trading company, compass, ship, daughter, pirate, swashbuckler, aftercreditsstinger"
1819,"roommate, love of one's life, newlywed"
2295,"independent film, aftercreditsstinger, duringcreditsstinger"
4474,"new york, flying, ex-boyfriend, ex-girlfriend, disappointment, supernatural powers, shark"
4962,"prison, bistrot, wealth"
