movieId,keywords
493,"bomb, gambling, helicopter, cemetery, coffin, attempted murder, investigation, observer, blaxploitation, grave digger"
4244,"age difference, midlife crisis, suppressed past, self-awareness, childhood memory, humor, changing the past or future"
4247,"sex, garage, psychopath, crude humor, drug"
1050,"mentally disabled, tradition, wife husband relationship, shower, modernity, modern society, wife, business man, bath house, marriage crisis, beijing, opera singer"
1052,"london england, photographer, burglar, tennis, loss of sense of reality, suspicion of murder, reality, surreal, municipal park, darkroom, pantomime, illusion, lovers, photography, pot smoking, corpse, photo shoot, fashion model, mod 1960s, counterculture"
1788,"dancing, dancer, dance, music, dance teacher"
1448,"sacrifice, vampire, crocodile, inspector, civil engineer, asthma, romance, misdirection"
2655,"secret, haunted house, ouija board, haunting, missing girl, ghost"
93,"rape, adultery, jealousy, michigan, judge, hays code, jazz, jurors, court case, lawyer"
6282,"bar, musical, beautiful woman"
5551,"nasa, space travel, astronaut, elderly"
2360,"drug dealer, greenhouse, police, drug, hoodlum"
26515,"witch, cabin, death of a child, murder, pumpkin, demon, evil, storekeeper, vengeance"
8420,"lolita, adoption, saint tropez"
2211,"berlin, jew, forbidden love, lesbian relationship, homosexuality, lesbian interest"
8843,"drowning, therapist, virtual reality, serial killer, psychopathy, fbi agent"
3110,"based on novel, gun, settler, gunfight, homestead, cattle ranch, gunfighter, cattleman, starting over"
26865,"radiation, minister, black and white"
1588,"cheerleader, sport, high school, teenage girl, cheerleading, cheering crowd, duringcreditsstinger"
137236,
1698,"butterfly, dissection, scalpel, medical school"
80713,"friends, neighbor, hospital, dog, womanhood, thinness, christmas lights, rocking chair, seville"
1619,"gunslinger, mexico, hotel, ransom, mexican standoff, kidnapping, sperm bank, from rags to riches, surrogate mother, money, gunfight, drifter, gangster, criminal, desert, millionaire, neo-western"
786,"hotel room, san diego, drug addiction, stewardess, overdose, groupie, music journalist, rock, heavy metal, concert, swimming pool, based on true story, promiscuity, coming of age, on the road, domineering mother, reconciliation, semi autobiographical, innocence lost, bus trip, aspiring writer"
170767,"spain, sex, nudity, miracle, artist, passion, exile, biography, army, bordeaux, art, aristocrat, duchess, flashback, tyranny"
77332,
16,"individual, dancing, usa, robbery, factory worker, secret, factory, small town, dance, blindness and impaired vision, death penalty, immigrant, eye operation, eyesight, fantasy, naivety, self-abandonment, hereditary disease, loss of eyesight, czech, dying and death, van, friendship, murder, teacher, debt, execution, crime, police officer"
34299,"independent film, woman director"
9003,"underworld, seduction, supernatural, pinhead, revenge, undead, demon, puzzle box, attic, cenobites, body horror"
26484,"beach, surfer, madcap comedy, anthropologist, beach movie"
469,"new york, bet, horse race, florida, hungary, card game, american dream, immigrant, cleveland, friendship, independent film"
2160,"mutiny, climate change, iceberg, nuclear missile, heat, race against time, torpedo, physicist, betrayal, laboratory, armageddon, electrocution, explosion, united nations, sabotage, diver, religious fanatic, brawl, moral dilemma, desertion, mini submarine, abandoned ship, giant  squid, disobeying orders, minefield, nuclear submarine, meteor shower, sky on fire, van allen radiation belt"
2161,"submarine, coma, claustrophobia, wound, laser, double agent, human body, shrinking, radioactive, miniaturization, doctor, scientist, sabotage, security, military, hypodermic needle, brain surgery, turbulence, scuba diver, blood clot in brain, microscopic"
3073,"dracula, frankenstein, horror spoof"
911,"usa, california, daughter, bank robbery, car chase, alcoholic, security guard, bank heist"
27475,"female nudity, sleepover, cannabis, neighbor, serial killer, slumber party, slasher, drill, woman director, murder spree, gym showers"
27764,woman director
1485,"hitman, british, gritty"
1597,"cia, airport, cat, jew, orderly, airplane, father-in-law, epistaxis, daughter, lost baggage, urn, pavilion, volleyball, hospital, wedding"
641,"drug addiction, junkie, heroin, speed, diet, unsociability, illegal prostitution"
6521,"politics, suspense"
78140,"senator, politics"
2134,"london england, inventor, future, time travel, dystopia, time machine"
27033,"alcoholic, district attorney, film noir"
71,"workers' quarter, dancing class, strike, northern england, scholarship, ballet"
1636,"love of one's life, wish, sale of soul, pact with the devil, demon, teuflisch"
4327,"martial arts, female friendship, millionaire, agent"
4958,"competition, world war i, great depression, caddy, savannah"
8870,"mars, future, astronaut, science, catastrophe"
681,"spy, fight, secret organization, satellite, secret agent, plastic surgery, smuggling, murder, extortion, violence, millionaire, fingerprints, dirt bike, casino owner, old woman murdered, high dive, gender disguise, aftercreditsstinger, master villain"
8452,"clone, future, murder, cloning, laser gun, dystopic future, implanted memory, sci-fi thriller"
8871,"holiday, christmas party, new love, santa claus, village, kids and family"
34045,"1970s, olympic games, hostage situation"
79920,
146,"flying, martial arts, taskmaster, comb, tiger, desert thief, theft, female martial artist"
2669,"female nudity, exotic island, mutiny, lake, nudity, sailing, ship, adventure, tahiti, murder, pregnancy, great barrier reef, sailor, native peoples, storm at sea, whipping, british sailor, based on true events, fiji"
2609,"thanksgiving, receptionist, slob, st. louis missouri, double take, o'hare airport chicago, chatter box,  wichita kansas, speeding ticket, chewing tobacco, credit card fraud, state trooper, sears tower chicago, unlikely friendship, aftercreditsstinger"
708,"london england, smuggling of arms, prison, england, assassination, spy, falsely accused, secret identity, country estate, arms deal, russia, drug traffic, secret mission, secret intelligence service, kgb, villain, renegade, special car, tangier morocco, big wheel, pipeline, cello, orchestra, freedom fighter, czechoslovakia, bratislava, afghanistan, airplane, schloss schönbrunn, escape, moscow, vienna"
1857,"toy, transformation, based on toy, transformers, robots, intergalactic war"
2604,"vietnam veteran, post traumatic stress  disorder, bar, 1970s, wheelchair, vietnam war, desert, spit in the face, drunkenness, 1950s, 1960s"
107,"gypsy, bare knuckle boxing, slang, trailer park, pig, sport, receiving of stolen goods, cockney accent, diamond, pikey"
392,"chocolate, mayor, praline, single, mother daughter relationship"
8859,"dude, amnesia, idiot, auto, friendship, cannabis, hangover, spoof, teenager, drug, alcohol abuse, celebration, car, duringcreditsstinger, child"
3981,"women, telepathy, supernatural powers, advertising executive, woman director"
711,"upper class, brother brother relationship, scotland, poetry, based on novel, mentor, becoming an adult, professor, literature, intellectually gifted, plagiarism, literature competition, private school, manuscript, seclusion, pulitzer prize, dying and death, idol, friendship, unsociability, high school, scholarship, father figure"
2046,"fortune teller, dream, pond, extrasensory perception"
5001,"suicide, gay, new york, cuba, aids, opression, totalitarian regime, artist, hot air balloon, exile, attempt to escape, fidel castro, cuban revolution, homosexuality, author"
5994,"workaholic, second chance, guardian angel, christmas, career vs family, life reprioritizing"
1493,"undercover agent, beauty contest, terrorism"
134,"prophecy, southern usa, music record, country music, mississippi, seduction, musical, fraud"
1900,"usa, war on drugs, drug traffic, drug dealer, drug smuggle, addicted, police operation, united states–mexico barrier, addiction, drug lord"
26719,"con man, fraud, gambling debts, noir"
2623,"love of one's life, navy, officer"
8043,"prisoner, train ride, governor, army, u.s. marshal, train"
5955,"promise, murder, drawing, porcupine, pledge, retirement party, criminal profile"
2613,"love at first sight, body exchange"
26333,"love, tragedy, orphan, baboon"
2018,"skab under tv, foran, nederste hylde"
37949,
5709,"tv addicted person, television, spoof, campy"
4639,"new york, bomb, california, robbery, detective, texas, attempted murder, police, sociopath, murder, suspense, heist, serial killer, author, gunfight, writer, police detective, exploding car, car explosion, nixon"
96,"smuggling of arms, detective, intensive care, undercover, strip club, armored car, investigation, police, swimming pool, sequel, shootout, gunfight, los angeles, explosion, violence, car chase, detroit, horse track, beverly hills, buddy cop, oil field, cement truck, playboy mansion, shooting range"
90,"california, showdown, undercover, strip club, investigation, weapon, police, smuggling, swimming pool, gunfight, mansion, los angeles, foot chase, art gallery, car chase, warehouse, beverly hills, buddy comedy, country club, maverick cop, detroit michigan, damsel in distress, bar fight"
30994,"punk, party"
764,"falsely accused, beheading, audio tape, log cabin, chain saw, giant plant, aggression by plant, lodge, friends, stop motion, evil, occult, book of the dead, necronomicon, demonic possession, video nasty, unofficial remake"
26964,"father son relationship, hotel, grandmother grandson relationship, videoband, video surveillance, dysfunctional family"
4918,"cold war, agent"
58084,
26156,"high school, youth"
2614,"experiment, shrinking, blood"
40962,
580,"shark attack, bahamas, dying and death, aggression by animal, sequel, revenge, underwater, shark, great white shark, animal attack, caribbean, christmas, banana boat"
1547,"street gang, small town, vampire, comic book, boardwalk, single, amusement park, mother son relationship"
2608,"wish, party, maid, woman director, fairy godmother, weird couple"
32058,woman director
843,"adultery, lovesickness, martial arts, newspaper, wife husband relationship, married couple, shanghai, deceived husband, forbidden love, marriage crisis, secret love, neighbor, author, hong kong, extramarital affair"
318,"hotel, confidence, junkie, book, friendship, insanity, los angeles, drug, fbi agent"
7093,"france, cook, prince"
1921,"workaholic, dogsitter"
6073,"kidnapping, pistol"
2749,"new york, female nudity, prison, prostitute, rape, robbery, fire, detective, airport, shotgun, prisoner, ex-detainee, attempted murder, paranoia, russian, eastern europe, video, knife, fistfight, police, thief, revenge, video camera, escape, breast, dead body, lawyer, shot to death, torture, fear, new york city, urination, violence, home invasion, criminal, police detective, death, drunk, nypd, news report, gun violence, graveyard, death of boyfriend"
49929,
2302,"usa, russia, jew, rabbi, synagogue, bar mitvah, emigrant"
32686,independent film
6028,"detective, death, movie star, murder mystery"
1888,"usa, american football, brother-in-law, wheelchair, honesty, cinematographer, insurance fraud, shadowing, fortune cookie, ex-wife"
2428,"jesus christ, biography, epic"
4986,blackmail
2453,"corruption, harley davidson, drug dealer, los angeles, las vegas"
4587,"dress, swimming, kennedy assassination, polka dot, aspiring nun, gynecological exam, jewish girl, shoe salesman, polka dot dress, roman catholic, bell ringing, reference to joan of arc, bell tower, 1960s"
31004,"romantic comedy, suspense, witty, whodunit"
4192,"egypt, hercule poirot, shipboard, murder mystery"
39934,"gay, aids, hiv, lgbt, lgbt history"
26580,
4985,"prison, american football, sport"
853,"winter, sniper, world war ii, stalingrad"
5257,"nasa, australia, moon landing, independent film, moon walk"
77,"individual, insulin, tattoo, waitress, amnesia, motel, insurance salesman, revenge, memory loss, polaroid, flashback, neo-noir"
2575,"dancing, spy, birthday, map, fireworks, bridge, secret agent, president, children, independent film, debt, swimming, political, band"
55,"homeless person, mexico city, daughter, secret love, dogfight, money, dog, nonlinear timeline, multiple storylines, new mexican cinema"
2043,"psychology, police operation, police, psychologist"
4133,"1970s, war on drugs, drug addiction, drug traffic, drug smuggle, rise and fall"
56715,"time travel, remake, alternate history, dragon, remake of french film, alternate timeline, flatulence"
26791,
634,"holiday, london england, england, alcohol, sex, lovesickness, telecaster, birthday, christmas party, news broadcast, sexual frustration, diary, cigarette, daughter, mother daughter relationship, lawyer, reporter, extramarital affair, duringcreditsstinger, woman director, christmas"
136558,
109472,
70282,
111,"miami, corruption, capitalism, cuba, prohibition, brother sister relationship, loss of sister, cocaine, cult film, bitterness"
2144,"conspiracy of murder, neo-noir"
1734,"son, ancient egypt, bracelet"
4973,"beach, wife husband relationship, sadness, disappearance"
8095,"ancient rome, historical figure, cleopatra, julius caesar"
849,"kingdom, lightsaber, cult favorite, dead body, magical object, fortress, doppelganger, cyclops, changeling"
27223,"gambling, yuppie, roulette, satire, winnebago, new york city, las vegas, fired from the job, recreational vehicle, road movie, hoover dam, crossing guard, nest egg"
2981,"central and south america, professor, dinosaur"
3784,"ex-detainee, cook, restaurant, greek, love, diner"
33743,dr. seuss
934,"italian, jewelry, safe, night club, burglary, newspaper stand, rough, silhouetted dancer, cigarette lighter, tuberculosis, cleaners"
5852,"car crash, police officer"
808,"magic, liberation, lordship, castle, robin hood, enchantment, fairy-tale figure, princess, parody, woman director, ogre"
824,"duke, musical, writer's block, music, terminal illness, writer, no opening credits, moulin rouge, bohemian, toulouse lautrec, red curtain, cancan dance, la traviata, orpheus and eurydice, dance hall"
676,"nurse, patriotism, hawaii, world war ii, pilot, pearl harbor, u.s. air force, airplane, war, army, love, pin-up"
26813,"nepal, himalaya, trek, yak"
50541,sport
26255,"new love, affection"
1406,"men, stetson, vacation, prairie"
1632,"suicide, ku klux klan, mississippi, sheriff, shotgun, deputy sheriff, fbi, motel, funeral, u.s. navy, victim of murder, burning cross, police, rope, racism, violence, fbi agent, based on true events"
966,"horse, village, friendship, remake, bandit, farmer, cowboy, mexican, white man's burden, henry rifle, hired gun"
301,"sheriff, small town, gun, marshal, deputy, murder, jail, stagecoach, gambler, cripple, gunfighter, two guns belt"
4988,"american football, sport, american football player"
6498,"night watchman, danish horror"
5923,"missionary, china, u.s. navy, chinese, battle, gunboat"
26475,"infidelity, ecstasy, party, independent film, woman director"
1089,"surfer, undercover, wave, surfboard, self-destruction, self-discovery, parachute, police operation, parachuting, moral conflict, los angeles, fbi agent, woman director"
759,"paris, father son relationship, robbery, diamant, revuegirls, double wedding, musical, jewelry, millionaire"
1995,"treasure, buddhist monk, planetary configuration, angkor wat, illuminati, william blake, treasure hunt, archaeologist, based on video game, archeology "
644,"artificial intelligence, prophecy, prostitute, android, loss of mother, extraterrestrial technology, ice age, adoption, fairy tale, pinocchio, prosecution, gigolo, hologram, dystopia, alien, destiny, capture, doppelganger"
2140,"paris, prostitute, drug"
4248,"sex, exorcism, secret door"
3134,"france, rape, women's sexual identity, revenge, murder, independent film, unsimulated sex, crime, violence, explicit sex, woman director, new french extremism"
26483,"musical, beach movie"
5991,"hotel, rain, uniform, inheritance, cigar smoking, gossip, silent film, imagery, noisy neighbor, bible quote, tip, porter"
6106,"civil war, dictator, journalist, guerrilla, loss of lover, revolution, war correspondent, civil rights movement , picture journalist, el salvador, dictatorship"
4789,"world war ii, deportation, jew persecution"
976,"new york, newspaper, brother sister relationship, jazz musician, media tycoon, film noir"
4780,"money delivery, sense of guilt, ransom, disappointment, false identity, florence, art restoration"
2114,"battle assignment, dystopia, alien, downfall, scientist, based on video game"
8835,"harvard law school, black female judge, smart blonde, girl power"
58904,
103489,
5333,"cia, drag queen, cat, flat, distrust, cohabitant, hitman, buenos aires, mission of murder, male friendship, film and cinema, boarder, film history, neighbor, cowardliness"
4281,"cruise, ship, private detective, murder mystery"
2,"underdog, prison, factory worker, prisoner, helsinki, independent film, falling in love"
26044,"billionaire, alcoholic"
3980,"sheriff, bounty hunter, cat, brother sister relationship, small town, barn, toilet, kansas, spaceship, alien, creature, explosion, family, exploding house, brother sister , alien fugitive, alien creature"
27397,"matchmaking, woman director, pickles"
27362,
5680,hostess
26386,holiday
25884,"fbi, fbi agent"
2617,"holiday, roommate, attachment to nature, grizzly bear, best friend"
26723,"musician, the beatles, music band, yoko ono, nude image, rock singer, nude drawing, mass media, george harrison, joy"
3543,"nevada, motel, highway, wilderness, rosenheim, car"
51321,"suicide, music, high school, woman director"
58434,
2605,"artificial intelligence, lightning, robot"
8740,"france, loss of lover, kidnapping, roadhouse, vacation, disappearance, missing person"
8337,"dystopia, social commentary, alien invasion, sunglasses, brawl"
47493,woman director
8463,"gay, new york, homophobia, homosexuality, based on play or musical, hate crime"
41974,"obsession, hitchhiker"
26603,"based on novel, role reversal, school, teen movie, body-swap, child as an adult, identity swap, adult as a child"
32049,
1648,"jealousy, journey in the past, sigmund freud, time travel, heavy metal, socrates, billy the kid, school presentation, rhinoceros, phone booth, world peace, past, history, metal, best friend, napoleon bonaparte"
4105,"japan, yakuza, japanese mafia"
3064,"paradise, heaven, loss of husband, daughter, afterlife, resurrection"
4925,"neo-nazi, colorado, suspense, los angeles"
2210,"dancing, sex, dream, musical, police, bikini, swimming pool, beauty salon, romantic comedy, spaceship, romance, alien, furry, hospital, makeover, nosy neighbor, discotheque, valley girl"
116014,"survivor, jewish"
27461,"world war ii, atomic bomb test, biography"
1380,"skateboarding, los angeles, skateboard"
505,"individual, prison, robbery, ex-detainee, operation, restart, new orleans, ugliness, mask, new identity, plastic surgery"
4486,"male nudity, library, transplantation, montreal, church, perfume, passion play"
4296,"airport, time warp, future, airplane, time travel, alien, independent film, disaster, airplane crash, crash, robot, scientist, paradox, investigator, based on short story, sole survivor, canuxploitation"
31606,"chicago, prisoner, hitman, suspense, sergeant"
8867,"loss of family, vigilante, marvel comic, based on comic, revenge, mafia, police officer, good and bad"
331,"exotic island, dna, paleontology, tyrannosaurus rex, velociraptor, spinosaurus, airplane, rescue, mission, dinosaur, jurassic park"
327,"brother brother relationship, assassination, culture clash, war on drugs, yakuza, sake, loyalty, drug dealer, femme fatale, los angeles"
1548,"high school friends, art class, record collector, plaster, personal ad, blues music, nunchaku, prank telephone call, aftercreditsstinger"
869,"gorilla, space marine, space suit, revolution, chimp, slavery, space travel, time travel, dystopia, alien planet, ape, human subjugation"
552,"venice, suicide, dancing, mother, depression, wife husband relationship, amateur detective, trip, married couple, tango, pescara, bus ride, accordion, florist, flower shop, plumbing supplier, roadhouse, family's daily life, mother role, oddball, mystic, self-discovery, mother-in-law, marriage crisis, marriage, freedom, little boy, family holiday, hitchhike"
2171,"adolescence, summer camp, independent film"
32261,"london england, sex scandal, scandal, based on true story, cabaret dancer, member of parliament, 1960s"
31083,"love triangle, man between two women, coming of age"
6951,"eating non food, pet food"
2616,"babysitter, backfire, attitude, tire, streetwise, drag net, crazy uncle, aftercreditsstinger, child care"
7091,"therapist, vampire, hallucination, bite, insanity, delusion, murder, dark comedy, night club, psychosis, drinking blood, method acting"
249,"gymnastics, candelabrum, cat, lawyer, dog"
183,"competition, video game, california, brother, utah, nintendo, on the road, road movie"
8494,"re animate, conga, dancing corpse, yanked off bikini top"
27431,"giallo, blind man"
2148,"jazz, jazz musician, musical, mafia"
2057,"women, sex, cuba, eroticism, lover (female), passion, coffee grower, sin, denunciation"
5175,duringcreditsstinger
4484,"gay, drag queen, 1970s, cabaret"
1627,"human experimentation, feral child, punishment, doctor, reward, tantrum, wild child, 18th century, learning, sign language"
2770,"sex, party, summer, beach house, group of friends, gross out comedy, tantra, mistaken for a special education student, superglue, sex comedy"
1933,"nanny, haunted house, channel islands, parallel world, photosensitivity, spiritism"
1722,"officer, greek island, mandolin, italian soldier, resistance fighter, greek history, italian army, allied forces"
2779,"hypnosis, independent film"
2294,"film making, jay and silent bob, self mocking, character is subject of comic, reference to prince valiant, indiana jones spoof scene, monkey actor, view askew, gigantic hand, animal experimentation"
26602,"beach, baseball, sport, bikini, party, love, romance, pool, summer, flashback"
742,"hippie, sweden, 1970s, roommate, ideology, socialism, feminism, commune, pacifism, utopia, single, alcoholic, anti-authoritarian"
8922,"mass murder, song, brother, sister, aftercreditsstinger"
5922,bounty hunter
106230,"gay, thailand, volleyball, based on true story, transgender"
5998,"identity, magic, mask, german mark, dollar, inflation, counterfeit, criminal, psychiatrist, disguise, stock exchange"
2176,"california, brother sister relationship, loss of parents, suspense, psychological thriller, orphan, car accident"
75386,"office temp, word processing"
2185,gadfly
2034,"police brutality, war on drugs, drug traffic, drug dealer, los angeles, gang member, mexican american, barrio, cholo"
32567,"expedition, glacier, rescue, antarctic"
27327,"phantom, musical, rock opera"
25767,"cheating husband, millionaire, oil tycoon"
33725,greyhound racing
248,"dude, prohibition, deception, new york city, apple, luck, dowager, high society, 1930s"
25905,"holocaust, nazis, slovakia, time of war"
1644,buried alive
66092,disturbed teenager
166,"paris, dancing, date, adultery, puberty, daughter, mother daughter relationship, teenage crush, youth, celebration"
1623,"prison, liberation of prisoners, prison warden, abuse, prison farm"
86463,
1716,"hiding place, jew persecution, jew, theatre play, theatre group, theatre milieu, rassengesetzte, independent film"
3172,prison
570,"holiday, rape, parent child relationship, sister sister relationship, puberty, first time, women's sexual identity, southern france, summer vacation, woman director, new french extremism"
1018,"schizophrenia, identity, amnesia, loss of sense of reality, suppressed past, trauma, key, bisexuality, hallucination, surreal, job interview, casting, suspense, independent film, lesbian, los angeles"
27396,"london england, scotland yard, cop, suspense"
26299,"florida, wealth, speedboat "
984,"ambush, san francisco, detective, ransom, stadium, sniper, mayor, kidnapping, nudity, chase, investigation, assault, police, psychopath, swimming pool, partner, beating, serial killer, gunfight, maniac, violence, city, school bus, dirty harry, elephone box, revolver, neo-noir"
768,"loss of family, drug addiction, jack the ripper"
2100,"prison, general"
3173,"gun, repayment, deaf-mute, hitman, male friendship, bangkok, thailand, friendship, mafia, killer, gunshot"
27092,"jealousy, psychological stress, gay relationship, argentina, bank robbery, lgbt, 1960s"
167,"robbery, dream, hypnosis, investigation, murder, alien, hospital, planet, patient, medication, psychiatrist, science, claim, doubt, mental, help"
27444,"sex, nudity, australia, love, lust"
141,"parent child relationship, airplane, time travel, school presentation, school performance, suburbia, vision, morality, teenager"
151727,
585,"monster, infant, energy supply, company, rivalry, hijinks, best friend, scream, conveyor belt, energy company, friend"
140511,
133115,"tourette syndrome, obsessive compulsive disorder"
671,"witch, christmas party, magic, cutting the cord, halloween, child hero, broom, chosen one, frog, fantasy world, based on young adult novel"
1535,"spy, china, cia, cold war"
1433,"bomb, sex, fight, nudity, war, supernatural, orphanage, revenge, murder, bully, fear, explosion, spanish"
1999,"age difference, fishing, arbitrary law, conductor, ex husband, single, independent film"
